tDept,tSid,institution_name,tFname,tMiddlename,tLname,tid,tNumRatings,rating_class,contentType,categoryType,overall_rating,review_quality_rating,review_difficulty_rating,review_class,review
Economics,298,Cornell University,Mathieu,Taschereau,Dumouchel,2697717,1,good,TEACHER,PROFESSOR,4.0,4.0,4.0,ECON3040,"Took his Intermediate Macro class this semester and I'm glad I did. Even over Zoom, he gives good lectures and his passion for the material comes through quite well. Grading is based entirely on problem sets and exams. The problem sets are simple enough but be sure to prepare well for the exams as they will probably be harder than you expect."
Engineering,298,Cornell University,T. Michael,,Duncan,9787,53,good,TEACHER,PROFESSOR,4.1,5.0,5.0,ENGRD2190,"A very respectable and respectful professor who genuinely cares about his students. His care takes the form of wanting the best for the student, which doesn't translate into lax standards in any way. Excellent explanations. Office hours are incredibly valuable."
Engineering,298,Cornell University,Thomas,,Duncan,1170951,2,good,TEACHER,PROFESSOR,5.0,5.0,5.0,ENGRI112,Best professor ever. Love him to death.
Engineering,298,Cornell University,Timothy,,Duncan,2111689,0,zero,TEACHER,PROFESSOR,N/A,,,,
Biology,298,Cornell University,James ,,Dunlea,2037340,1,good,TEACHER,PROFESSOR,4.5,4.5,4.5,BIOG1445,"Excellent TA! He is hard during oral tests, but helps students out too. Although he is a hard TA, he's easy on the eyes. He cares about his students. Makes an effort to meet outside of class, brought breakfast for section a few times!"
Psychology,298,Cornell University,David,,Dunning,186100,46,good,TEACHER,PROFESSOR,3.9,5.0,5.0,PSYCH389,Dunning knows how to deliver a captivating lecture. He doesn't just read his slides - he presents it in a way that makes the material stick. Probably the best lecturer I've had. He's clearly very well-read. He goes over interesting topics in the class. Very engaging and approachable. One of the best Psych classes I've ever taken.
English,298,Cornell University,Travis,,Duprey,1914359,2,good,TEACHER,PROFESSOR,5.0,5.0,5.0,FWS2020,Ask him for help and go to the writing center.
Languages,298,Cornell University,Daniel,,Duque,932565,5,good,TEACHER,PROFESSOR,4.8,5.0,5.0,SPAN2090,"Daniel is the man. Super chill, great sense of humor and informal style of teaching. Doesn't make you feel too pressured when you're talking, which is good because talking in class is definitely emphasized. Have to study on your own a lot for the tests but he makes class as fun as it could be."
Human Resources Management,298,Cornell University,Lee,,Dyer,1930119,0,zero,TEACHER,PROFESSOR,N/A,,,,
Anthropology,298,Cornell University,Holly,,Dygert,1179094,1,poor,TEACHER,PROFESSOR,1.0,,,ATHR169,"Boring as ever..unclear..not meant to be a teacher..very indecisive...you can tell she knows her stuff, but you're better off teaching it to yourself..has an EXTREMELY hard time extending her knowledge to the students....on a scale from 1-10 I would give her a 1.5...she's nice and all, but ill-suited as a teacher"
Communication,298,Cornell University,Brian,,Earle,195461,23,good,TEACHER,PROFESSOR,4.7,5.0,5.0,AEM4940,Great guy
History,298,Cornell University,Corey Ryan,,Earle,1829783,3,good,TEACHER,PROFESSOR,4.7,4.0,4.0,AMST2001,"Literally the easiest A+ you could possibly get at Cornell. Honestly, I felt a little bad throughout the course because since it was so beyond easy, nobody took the course seriously. A few extra mandatory assignments could make the course better in my opinion to keep students engaged. Lectures and professor were great otherwise."
Engineering,298,Cornell University,Christopher,,Earls,1095683,7,good,TEACHER,PROFESSOR,4.6,5.0,5.0,ENGRI1160,"I LOVED THIS CLASS!!! Made me really excited about Civil Engineering. The class was easy and interesting. Earls is really passionate about the material. Very helpful in office hours. No textbook, a few short homeworks, 1 paper, and a group project in the place of a final. The project was fun and a great way to apply the material. My favorite class."
Statistics,298,Cornell University,Cecilia,,Earls,2045830,9,average,TEACHER,PROFESSOR,2.6,4.0,4.0,BTRY3090,"This is NOT a stats class, it's a financial mathematics class. You will be plugging in formulas - start memorizing early. Multiple new concepts are introduced in every lecture and there is no discussion, just a three 75 minute lectures and office hours. Homeworks are not like the lecture examples but do reflect the difficulty of the exams."
Economics,298,Cornell University,David,,Easley,187593,36,good,TEACHER,PROFESSOR,4.3,5.0,5.0,SOC2090,"Amazing class and professor! It was a super interesting class, but there is a lot of work. weekly hw assignments that take a few hours to complete, but if you take time and do them well, the tests are easy and straight forward just like the hw."
Languages,298,Cornell University,Emily,,Eaton,1024799,3,good,TEACHER,PROFESSOR,4.3,5.0,5.0,SPAN2140,"Very kind and helpful professor, happy to meet outside of class, but very easy to understand in class."
Psychology,298,Cornell University,Shimon,,Edelman,560026,24,poor,TEACHER,PROFESSOR,2.4,5.0,5.0,PSYCH4230,Easy A..
Ethnic Studies,298,Cornell University,Locksley,,Edmondson,620969,9,average,TEACHER,PROFESSOR,2.8,4.0,4.0,2003,Lot of information to process. Fairly interesting lecture with movies. Very few tests but stuff from the tests are mentioned in a random few of the many readings. Pretty picky when he grades his long papers but you have plenty of time to do them. You can skip class and forgo the grade bump but make sure to not get lost.
English,298,Cornell University,Stevie,,Edwards,1826508,4,poor,TEACHER,PROFESSOR,2.2,,,ENGL1105,"So disorganized and very awkward. She's an easy grader and the material should have been interesting, but she does not know how to lead a discussion. The class was such a waste of time. "
Economics,298,Cornell University,Ronald,,Ehrenberg,235224,25,good,TEACHER,PROFESSOR,4.2,5.0,5.0,ECON3410,An extremely knowledgeable and respected professor
Writing,298,Cornell University,Irene,,Eibenstein-Alvisi,2495620,4,good,TEACHER,PROFESSOR,3.8,4.0,4.0,ITAL2203,"Alvisi was great and taught me a lot about Italian literature. I really enjoyed her classes, and I definitely would have enjoyed them more if they were in person. Just be sure to participate a ton and always come prepared, she respects that a lot."
Communication,298,Cornell University,Danielle,,Eiseman,2767771,0,zero,TEACHER,PROFESSOR,N/A,,,,
Engineering,298,Cornell University,Mark,,Eisner,328005,7,poor,TEACHER,PROFESSOR,2.4,4.0,4.0,ORIE516,No Comments
Biology,298,Cornell University,Tom,,Eisner,334772,15,good,TEACHER,PROFESSOR,4.6,5.0,5.0,BIONB4200,"This guy is a living legend.  He has over 500 published papers, and has been the pioneer for the field of chemical ecology.  His story-telling is fantastic, and all of the stuff he talks about is just so interesting.  One of my favorite professors that I have ever had, I stand in awe of his accomplishments as a researcher and a teacher."
Philosophy,298,Cornell University,Matti,,Eklund,1085556,4,good,TEACHER,PROFESSOR,3.8,5.0,5.0,PHIL2300,"To be fair, I was really excited for this class before I took it. You just talk about paradoxes the entire course. It's great. Just show up to lecture, minimal readings that are basically optional. Very helpful lecture notes distributed in class. Class makes you think. Explains things clearly and thoroughly. Grading was kind of tough though."
Statistics,298,Cornell University,Ahmed,,El Alaoui,2760033,8,poor,TEACHER,PROFESSOR,2.0,4.0,4.0,BTRY3080,"Nice guy, but as many of these others comments say: lectures weren't that helpful since it was review of textbook stuff. However, I think he gets a worse rep than he deserves. Tests were doable despite the median of around 50%. Nonetheless, the final median grade was an A-. Two tests 20% each, final 40%. Not too much hw and could be found online."
History,298,Cornell University,Allison,,Elias,1965327,8,good,TEACHER,PROFESSOR,4.1,4.0,4.0,ILRLR1100,"A lot less reading than the other labor history profs, and grades a little bit easier.  Tough TA made assignments tougher, so a lot of work has to be put in at times, but reasonable effort can get you a good grade."
Design,298,Cornell University,Jack,,Elliott,460231,18,good,TEACHER,PROFESSOR,3.8,4.0,4.0,DEA1101,The class was interesting and took me out of my comfort zone. Jack was also very accessible through office hours and would get back to you on any questions about the assignments. It did get difficult to sit for three hours and listen to lectures for an extended period of time.
Organizational Behavior,298,Cornell University,Lillien,,Ellis,2570718,9,good,TEACHER,PROFESSOR,4.8,5.0,5.0,ILROB2255,GOAT. Interesting topic. Class is mainly paper-based with one group final project. Prof. Ellis is great.
Computer Science,298,Cornell University,Kevin,,Ellis,2755141,0,zero,TEACHER,PROFESSOR,N/A,,,,
Human Environmental Science,298,Cornell University,Stephen,Paul,Ellner,2618485,0,zero,TEACHER,PROFESSOR,N/A,,,,
Sociology,298,Cornell University,Parfait,,Eloundou-Enyegue,299858,14,average,TEACHER,PROFESSOR,3.4,5.0,5.0,GDEV1102,"Parfait is very smart and has an incredible amount of experience and knowledge. Regardless, listening to him lecture is mind-numbing. His lectures are boring and disengaging. I enjoyed the class content but lectures were so hard to follow because he just seemed so uninterested in teaching them."
Physics,298,Cornell University,Veit,,Elser,272258,34,average,TEACHER,PROFESSOR,3.0,5.0,5.0,PHYS2217,"Very kind and caring (brings cookies to exams!) I'm not sure why there are such poor reviews, but I had the pleasure of taking Prof. Elser's 2217 class in the Fall. Lectures are very well organized, and the structure is very intuitive. I will say, the wording on HWs and exams were sometimes confusing (I wasn't always sure of what he was asking."
Biology,298,Cornell University,Susan,,Ely,1160413,3,good,TEACHER,PROFESSOR,4.7,4.0,4.0,BIOBM3330,Study for her quizzes like you would a Prelim. Study lecture guides thoroughly...and only use the textbook when you need clarification...She is very helpful during office hours....
Economics,298,Cornell University,Hassan,,Enayati,1962696,2,good,TEACHER,PROFESSOR,5.0,5.0,5.0,ILRLE2400,"A great professor. He is clearly very knowledgable. There wasn't a lot of feedback regarding what you got wrong on the Problem Sets and exams, but he was very easy to get a hold of in office hours. He has a great career ahead of him. Make sure you keep up with the material and ask questions and you'll be fine. "
Biomedical Engineering,298,Cornell University,James,,Engstrom,2351888,1,good,TEACHER,PROFESSOR,5.0,5.0,5.0,CHEME4840,Very relaxed class on very interesting topics. Would definitely recommend taking his class for an interesting and relatively easy advanced chemical engineering elective course.
Government,298,Cornell University,Peter,,Enns,1176884,3,good,TEACHER,PROFESSOR,5.0,5.0,5.0,4000,Peter is by far the most helpful professor I have had at Cornell. He is always approachable after class and gives detailed comments on papers. Go to his office hours even if you don't have a specific question to ask. He is a nice person to talk to and he really likes getting to know students personally.
English,298,Cornell University,Sarah,,Ensor,1083215,3,good,TEACHER,PROFESSOR,5.0,5.0,5.0,ENGL1158,"She will help you with all your writing as long as you seek out the help! As long as you work hard, you will become a much better writer!"
Statistics,298,Cornell University,Jeremy,,Entner,2538397,21,poor,TEACHER,PROFESSOR,2.0,4.0,4.0,BTRY3020,"Just cannot understand him for some reason. I have taken stats class with another prof and found it interesting; however, he pushed me away from learning more stats."
Hospitality,298,Cornell University,Cathy,A,Enz,1882731,2,average,TEACHER,PROFESSOR,2.8,4.5,4.5,HOS101,"Very difficult professor, and very disruptive and loud."
Asian Studies,298,Cornell University,Pedro,,Erber,1172152,3,good,TEACHER,PROFESSOR,3.8,4.5,4.5,PORT3690,cool guy
Agriculture,298,Cornell University,Griffin,J.,Erich,2754807,1,good,TEACHER,PROFESSOR,5.0,5.0,5.0,NTRES2010,Griffin Erich is amazing. He sure knows his paw-paws! Ask him about his strawberries.
Engineering,298,Cornell University,David,,Erickson,766131,9,poor,TEACHER,PROFESSOR,2.4,5.0,5.0,ENGRD2210,You might start crying during his exams. Bring tissues or a sense of humor.
Mathematics,298,Cornell University,Paul,,Erickson,1289914,2,good,TEACHER,PROFESSOR,4.8,5.0,5.0,MATH1003,No Comments
Marketing,298,Cornell University,Scott,G,Erickson,2561462,3,average,TEACHER,PROFESSOR,2.7,,,HADM2410,"Lecture heavy and a bit monotone. Lots of examples in class. Some textbook use. Weekly quizzes but open note and plenty of time to complete time. Two exams and a group project. Seems like a nice man, very chill class."
Computer Science,298,Cornell University,Ali,,Erkan,2669887,0,zero,TEACHER,PROFESSOR,N/A,,,,
Music,298,Cornell University,Kevin,,Ernste,840146,7,good,TEACHER,PROFESSOR,4.3,4.5,4.5,MUSIC1421,I would not recommend Professor Ernste to anyone. He is extremely unresponsive to student's emails and concerns. Really disappointing experience overall.
Linguistics,298,Cornell University,Juan,Manuel,Escalona Torres,2751328,2,good,TEACHER,PROFESSOR,5.0,5.0,5.0,SPAN2090,"Professor Escalona Torres is so charismatic and intellectual. I enjoyed the material he brought to class, which he tried to personalize and relate to real life and his own life as well. I think he tried to make Spanish practical for us, but the Spanish department at Cornell really limits what he can do."
Engineering,298,Cornell University,Mahdi,,Esmaily Moghadam,2565568,4,average,TEACHER,PROFESSOR,3.3,5.0,5.0,MATH2930,"Lectures weren't clear or organized, and had trouble explaining concepts in an accessible way. The final exam was quite unfair (avg was a 60), leading to low course grades."
Languages,298,Cornell University,Juan,,Espinosa,1282778,3,good,TEACHER,PROFESSOR,4.7,5.0,5.0,SPAN2190,"He was a great instructor. The class is a lot of work if you want to do well, but he is clearly very invested in the students and makes the discussions interesting. I would definitely recommend him!"
Materials Science,298,Cornell University,Lara,,Estroff,1535449,2,good,TEACHER,PROFESSOR,3.5,4.0,4.0,MSE301,Tough class but very interesting and Estroff is more than willing to help. One of my favorite professors!
English,298,Cornell University,Darlene,,Evans,461191,24,average,TEACHER,PROFESSOR,3.5,5.0,5.0,WRIT1420,"cares a lot about her students. Fair grader but you have to put efforts. Probably a bit more workload than other FWS at Cornell, but it's worth it. Take her class, Darlene is great"
Political Science,298,Cornell University,Thomas,,Evans,1097537,7,average,TEACHER,PROFESSOR,3.4,5.0,5.0,ECON112O,"Everything is through Aplia, so international students need a US VPN. Every assignment was time-consuming & nothing like the test. The textbook was useless. 70% of the grade was based on 2 tests. Multiple choice questions were ok, but the essay questions were time-consuming & tough. The comments he gave on them were vague, unrelated, & confusing."
Business,298,Cornell University,Thomas,,Evans,2602803,0,zero,TEACHER,PROFESSOR,N/A,,,,
Design & Environmental Sciences,298,Cornell University,Gary,,Evans,1269627,29,good,TEACHER,PROFESSOR,4.2,5.0,5.0,DEA1500,"Professor Evans is such a great professor. The material in this class is super interesting no matter what your major is. The work is very manageable. It's clear that Professor Evans loves teaching, and he is very kind person and wants his students to succeed."
English,298,Cornell University,Olivia,Milroy,Evans,2735032,1,good,TEACHER,PROFESSOR,5.0,5.0,5.0,ENGL1111,"She is the best FWS teacher I have ever had. Although I never asked for one, she is willing to give extensions to anyone based on their circumstance. And she grades all of the work through completion, only if you are on the right track of the goal of the assignment."
Economics,298,Cornell University,Tom,,Evans,1043721,31,good,TEACHER,PROFESSOR,3.8,4.0,4.0,PAM2100,He is very strict with students attending lecture ON TIME WITH ICLICKER. If you show up 2min late you might as well go back to bed because you would have missed the iclicker. His lectures are extremely boring and homework are harder than what he expects in the lecture. His instructions are confusing and his jokes are lame too....
Engineering,298,Cornell University,Rick,,Evans,804700,10,poor,TEACHER,PROFESSOR,2.4,4.5,4.5,ENGRC3025,"I feel like Cornell keeps the Engineering Communications requirement just to keep Rick Evans employed. This is the most useless course I've ever taken at Cornell. Makes you read and cite a simple-minded ""book"" written by an unknown SJW ""writer"". Also, a very self-important and arrogant individual, for seemingly no reason."
African Studies,298,Cornell University,Jerel,,Ezell,2771291,1,good,TEACHER,PROFESSOR,4.0,4.0,4.0,ASRC4002,"As a stem major, I took this class S/U to fulfill a course dist. requirement. Jerel is a great teacher, and the class itself is generally low-stress. Lots of readings, small group discussions and occasional papers, but he is not a tough grader and I found his feedback valuable."
Chemistry,298,Cornell University,Gregory,,Ezra,1704715,5,average,TEACHER,PROFESSOR,3.0,5.0,5.0,CHEM3890,"The course material is hard as it is, and Dr. Ezra has relatively good lectures. The problem is the exams. They are very difficult and you only get 90 minutes.."
Science,298,Cornell University,Tim,,Fahey,98766,39,good,TEACHER,PROFESSOR,3.5,4.0,4.0,NTRES4200,"Knows his stuff, but bad with technology which hampered covid semester. The lecture was entirely just listening to him with PowerPoint visuals (no text on ppt), sounds like you are listening to NPR podcast + hard to take notes. But interesting material, not difficult class so long as you listen to the lectures and do the weekly homework question."
History,298,Cornell University,Ziad,,Fahmy,1659689,15,good,TEACHER,PROFESSOR,4.2,4.0,4.0,NES2670,Great lecturer who cares about his field and knows what he's talking about. Studying for tests is relatively easy as his lectures are very closely aligned with the textbook and the slides are all posted online and are very comprehensive. Essay grading can be a little difficult because it's a little unclear exactly what he's looking for.
Philosophy,298,Cornell University,Frances,,Fairbairn,2337060,4,good,TEACHER,PROFESSOR,4.0,5.0,5.0,PHIL101,Not the easiest intro prof but gives great feedback and is super helpful. Grading is still more than fair though. Every class is interesting and she keeps everyone engaged. Very smart and would recommend 100%
Anthropology,298,Cornell University,Jane,,Fajans,217660,23,poor,TEACHER,PROFESSOR,2.1,4.0,4.0,ANTH2450,"Keep up with the readings, lectures are boring, but I thought the material was decently interesting (maybe not to everyone). Class isn't too hard if you keep up, and exams just require you to regurgitate material."
History,298,Cornell University,Oren,,Falk,268443,43,average,TEACHER,PROFESSOR,2.9,5.0,5.0,HIST1180,WORST DECISION OF THE SEMESTER. Class was on viking peoples and many readings were in Old Norse... that nobody knew how to read???? At one point he made someone cry because he misinterpreted what he/she said and then continued to insist that he was correct in his interpretation. He also compared my writing to a mental disorder...
Economics,298,Cornell University,Louis,,Falkson,1108287,5,average,TEACHER,PROFESSOR,2.7,,,ECON4300,"Heavily biased grading in History of Economic Analysis. The structure is that you essentially get 2 grades and they are weighted in some ambiguous way (not listed on syllabus) for your final grade. 8:40 class, provides useless feedback on papers, and is downright cold . Take anything else  Received a grade much lower than expected with no warning."
Physical Ed,298,Cornell University,Arthur,,Falkson,726776,6,good,TEACHER,PROFESSOR,4.5,5.0,5.0,PE1447,"Generally, I would only recommend to take this if you already had some tennis experience beforehand (at least JV ish level). Pretty chill guy, actually found out that he knew some of the kids who played tennis back home. Class is a little bit of a workout (definitely kept me in shape haha). Overall, definitely recommend."
Writing,298,Cornell University,Tamra,,Fallman,1667067,3,good,TEACHER,PROFESSOR,5.0,5.0,5.0,ROMS1104,"Tamra is AMAZING. Such an entertaining person, genuinely cares about all of the students. The kind of instructor you would take your personal, not just academic, problems to. Highly recommend her for an FWS. Also a very fair grader, this class was easy."
Computer Science,298,Cornell University,Daisy,,Fan,202231,131,good,TEACHER,PROFESSOR,3.5,5.0,5.0,CS1112,Prof. Fan is really enthusiastic about giving students a proper introduction to computing; her lessons are useful in areas beyond just MATLAB. She has plenty of experience and it shows -- her way of teaching was so eloquent I often found myself forgetting to take notes. Tests are not difficult there are a LOT of projects/assignments that take hours
Computer Science,298,Cornell University,Anna,,Fang,2305885,1,good,TEACHER,PROFESSOR,5.0,5.0,5.0,CS3110,"Very clear, exercises are really helpful, would take again 10/10! Best at Cornell!"
Ethnic Studies,298,Cornell University,A.R.,,Fatihi,342999,12,good,TEACHER,PROFESSOR,3.6,4.0,4.0,HINDI101,Amazing
English,298,Cornell University,David,,Faulkner,1470173,8,average,TEACHER,PROFESSOR,3.4,4.0,4.0,ENGL1191,Super flexible with deadlines but lectures are useless and doesn't give much graded feedback until the very end of the semester
Languages,298,Cornell University,Elisabeth,,Fay,1246460,2,good,TEACHER,PROFESSOR,3.5,5.0,5.0,ITAL2950,"She talks ALL THE TIME, and wouldn't let anyone else put in a word edgewise. She can also be really sarcastically sweet with the students she doesn't like. If given a choice, I would not take another course with her."
Human Ecology,298,Cornell University,David,,Feathers,1705150,1,good,TEACHER,PROFESSOR,5.0,5.0,5.0,DEA3520,Professor Feathers is one of the most amazing professors I've ever had. He's genuinely concerned about his students' well-being and the material is very reasonable.
Philosophy,298,Cornell University,Mark,,Fedyk,1353143,4,good,TEACHER,PROFESSOR,4.9,5.0,5.0,PHIL1421,Great prof!
Biology,298,Cornell University,Gerry,,Fegeinson,1384916,1,good,TEACHER,PROFESSOR,5.0,5.0,5.0,BIOBM3310,"Class is definitely better than taking auto-tutorial.  The prof was very interesting and organized, but the TAs were the worst I have ever experienced. Prof is really helpful...use his office hours because he will hint what is on the quizzes.  Weekly quizzes are a pain to study for but will really help your grade.  Tests are really specific."
Science,298,Cornell University,Gerald,,Feigenson,28520,40,good,TEACHER,PROFESSOR,4.6,5.0,5.0,BIOMG3310,"AMAZING PROF! I can't imagine having learned biochem from anyone else. Clearly covers difficult concepts, so helpful and welcoming during office hours even just to chat about non biochem related topics. So sad he is retiring from teaching, one of the best!"
Sociology,298,Cornell University,Shelley,,Feldman,224516,8,poor,TEACHER,PROFESSOR,1.6,4.5,4.5,SOC,"Shelley Feldman's approach reflects a dangerous trend in academia. She is a postmodernist ideologue for whom there is no objective truth, except for hers of course. For her science is a tool that allows western white males to maintain power. This is what happens when you're so open minded your brain falls out. She is not a teacher, she is a bully."
Theater,298,Cornell University,David,,Feldshuh,666666,8,good,TEACHER,PROFESSOR,5.0,5.0,5.0,PMA3880,"David is amazing! Be prepared to work really hard and dedicate a ton of time to the class, but also get ready to learn SO much."
Human Ecology,298,Cornell University,julia,,felice,2383768,1,good,TEACHER,PROFESSOR,5.0,5.0,5.0,NS1200,This class includes many guest speakers. Dr. Felice herself is such a sweet person. She is very understanding and willing to help if you have an issue. The class itself isn't hard at all. Just show up and listen. There are also two projects which aren't bad.
English,298,Cornell University,Briel,,Felton,2625329,4,good,TEACHER,PROFESSOR,4.8,5.0,5.0,ENGL1183,"Such a nice Professor, I absolutely loved this class. Such a fun and great FWS. She priorities you above all else and does not punish you for taking mental health days. My favorite class I have taken in Cornell so far. I can imagine someone disliking her, such a great person. Gave us snacks for Halloween and Christmas to celebrate the holidays :)"
Physics,298,Cornell University,Craig,,Fennie,1315468,10,average,TEACHER,PROFESSOR,2.8,5.0,5.0,AEP5500,"Really insightful when it comes to teaching about his research field, perovskites; and gives you intuitive ways of thinking about concepts without doing too much math.  The course organization was great."
Psychology,298,Cornell University,Melissa,,Ferguson,469291,6,good,TEACHER,PROFESSOR,4.2,5.0,5.0,PSYCH3800,This class was ridiculously easy as long as you show up to lectures and do the readings. The class itself is interesting but the textbook is super boring - just skim the chapters and you'll be fine. 2 exams and a non-cumulative final - all multiple choice with a few short answers. Lots of bonus/extra credit point available. Prof is really sweet
