tDept,tSid,institution_name,tFname,tMiddlename,tLname,tid,tNumRatings,rating_class,contentType,categoryType,overall_rating,review_quality_rating,review_difficulty_rating,review_class,review
English,298,Cornell University,Michael,,Koch,1255267,4,good,TEACHER,PROFESSOR,4.9,5.0,5.0,ENGL3820,"Professor Koch is absolutely fantastic! He's really great at keeping class discussions going in the right direction by asking incisive questions, but is never overbearing. Incredibly positive, constructive comments in private meetings. Excellent readings, and his story-reading voice is second to none. Highly recommended!"
Engineering,298,Cornell University,Donald,,Koch,354180,6,poor,TEACHER,PROFESSOR,2.0,4.0,4.0,CHEME3240,"Don Koch taught Heat and Mass Transfer Fall 09. He had good lecture notes that you can follow. He presented the material well and explained any confusion. However, the homework and prelims tend to be tedious and hard. However office hours were very useful."
Biology,298,Cornell University,Walter,,Koenig,1257816,2,good,TEACHER,PROFESSOR,5.0,5.0,5.0,BIONB2100,Lectures were very entertaining and informative.  Tells a good story.
Engineering,298,Cornell University,Boris,,Kogan,1931840,3,good,TEACHER,PROFESSOR,5.0,5.0,5.0,MAE3260,"Tests and HWs are tough and not doable unless you've gone to class. His grading policy is probably the fairest I've ever seen, albeit decently strict. Show respect. In the eternal words of Boris Kogan: ""You disrespect class, you disrespect me."""
Comparative Literature,298,Cornell University,Marc,,Kohlbry,2761225,0,zero,TEACHER,PROFESSOR,N/A,,,,
History,298,Cornell University,Julilly,,Kohler-Hausmann,2241444,4,good,TEACHER,PROFESSOR,5.0,5.0,5.0,HIST1640,"By far the friendliest and most caring professor I have ever had at Cornell. That said, this class is a lot of work, but if you are willing to read and write a lot, and have relative proficiency at these skills, this class should not be an issue for you."
Hospitality,298,Cornell University,Heather,,Kolakowski,2738024,0,zero,TEACHER,PROFESSOR,N/A,,,,
Philosophy,298,Cornell University,Daniel,,Koltonski,2161249,0,zero,TEACHER,PROFESSOR,N/A,,,,
Economics,298,Cornell University,Nolan,A,Kopkin,1758378,1,poor,TEACHER,PROFESSOR,1.0,,,AFRIC100,"I've never taken such a confusing course. I completed all the homework, read the textbook, and watched the films, yet I failed the quizzes. We had to read 70+ textbook pages a week and watch 1-2 hour films each week. The quizzes seemed to ask questions about topics not covered! I had to W so I didn't have an F. For perspective: my gpa is a 3.8."
Molecular Biosciences,298,Cornell University,Amnon,,Koren,2278223,0,zero,TEACHER,PROFESSOR,N/A,,,,
Human Ecology,298,Cornell University,Lauren,,Korfine,2379505,6,good,TEACHER,PROFESSOR,5.0,5.0,5.0,HD2830,"Definitely the kindest professor at Cornell. I didn't really like the class because of the subject matter, but the professor taught it well nonetheless. Very sweet, knowledgeable, and on top of things."
Physics,298,Cornell University,David,,Kornreich,1889429,8,good,TEACHER,PROFESSOR,3.5,4.0,4.0,ASTRO1107,"He makes you think critically for the required discussions. His lectures are taught well and it was obvious that he was really passionate about Astronomy. I looked forward to the labs and lectures because they demonstrated interesting things about space. The assignments and quizzes were manageable, and the essay was the only difficult thing I did."
Philosophy,298,Cornell University,Theodore,,Korzukhin,2752075,2,poor,TEACHER,PROFESSOR,1.0,,,PHIL1101,"felt like this class was a complete afterthought to him. slides were never posted online consistently. also was stingy about sharing readings online. hard to hear in lecture as well. overall, not fun"
Human Ecology,298,Cornell University,Simon,,Kosali,1381134,1,good,TEACHER,PROFESSOR,5.0,5.0,5.0,PAM4370,"Prof. Simon is, in a word, amazing. This was one of the most interesting classes I've taken in a while, and she really knows a lot about the material (health policy). She was extremely helpful, very responsive to email, and would always do whatever it took to help you understand the material. Tests are fair, and the research project is appropriate."
Philosophy,298,Cornell University,Michelle,A,Kosch,1904355,3,good,TEACHER,PROFESSOR,3.7,4.5,4.5,PHIL2240,"Prof Kosch is definitely brilliant. She's a nice person but her brilliance can lead to unintended condescension. She simply won't answer your question if it is answerable in the text.  Also, tests are unnecessarily hard. And if you don't do 90% of the reading you'll be in rough shape. Simply stated, the class is super hard."
History,298,Cornell University,Vic,,Koschmann,134037,8,good,TEACHER,PROFESSOR,4.7,5.0,5.0,HIST3330,"No qualms. Average amount of papers, tests are straight forward short essays. About 200 pages of reading a week but maybe thats because its a history class."
History,298,Cornell University,Julien,Victor,Koschmann,2158329,0,zero,TEACHER,PROFESSOR,N/A,,,,
Psychology,298,Cornell University,Barbara,,Koslowski,454957,12,good,TEACHER,PROFESSOR,3.5,5.0,5.0,HD2380,"Although I was able to make up for this fact, her lectures and notes were entirely disorganized and her tests were poorly worded. It was easy to see why my classmates had difficulty drawing larger themes out of what she presented in class. Her research has lagged of late, making her frustrated and difficult to work with. Avoid joining her lab."
Engineering,298,Cornell University,Vaclav,,Kostroun,132153,6,poor,TEACHER,PROFESSOR,2.3,,,AEP361,"Worst professor in cornell for me also. Harsh grading, does not listen to students, and likes suck-ups. Extremely unhelpful."
Engineering,298,Cornell University,Lena,,Kourkoutis,2061537,7,good,TEACHER,PROFESSOR,4.8,5.0,5.0,ENGRI1200,"If I could describe this course in one word, it would be hell. There's no textbook and limited resources to help you understand the upper-level engineering topics presented. Despite this, it's a really interesting course. Prof. Kourkoutis makes lectures engaging and she's the best person to teach it. Prepare to be outshined by ECE/AEP kids though."
Design,298,Cornell University,Frances,,Kozen,2411885,0,zero,TEACHER,PROFESSOR,N/A,,,,
Computer Science,298,Cornell University,Dexter,,Kozen,153936,28,good,TEACHER,PROFESSOR,4.2,5.0,5.0,CS4820,"Clear lecturer who cares about students' understanding of the material. Will answer many Piazza posts personally, and made reasonable adjustments to the course due to its virtual format."
Earth Science,298,Cornell University,Cliff,,Kraft,2744522,0,zero,TEACHER,PROFESSOR,N/A,,,,
Architecture,298,Cornell University,Dan,,Krall,1663379,0,zero,TEACHER,PROFESSOR,N/A,,,,
Political Science,298,Cornell University,Isaac,,Kramnick,145427,60,good,TEACHER,PROFESSOR,3.9,4.5,4.5,GOVT1615,"Honestly a great professor who makes the material interesting by both expanding on it and throughly expanding on it. Though he barely involves student opinion/answers in his lectures, so if you get a chance you better not embarrass   yourself. But overall explored the material thoroughly and his outlines prior to the lecture made note taking simple"
Physics,298,Cornell University,Philip,,Krasicky,226122,72,good,TEACHER,PROFESSOR,4.0,5.0,5.0,PHYS1112,"Phil's lectures always have so much infectious energy and enthusiasm. His demonstrations are clear and he always tries to explain common mistakes that students may make. There is reading before each class (""flipped classroom"") and the content is as difficult as any intro physics class."
Science,298,Cornell University,Lee,,Kraus,231331,5,good,TEACHER,PROFESSOR,3.5,5.0,5.0,BIOBM4390,"GREAT CLASS. Clear lectures, tons of resources on blackboard, not much ""required reading."" Know lecture material, and read supplementary resources as it interests you. If you want to understand disease on a molecular level, it's a great overview. TAs extremely helpful as well as the prof."
Government,298,Cornell University,Sarah,,Kreps,2561694,6,good,TEACHER,PROFESSOR,3.5,5.0,5.0,GOVT3042,"Not sure if it was because of COVID and zoom classes or what, but when I took this class it was almost exclusively guest lectures and the assignments had absolutely nothing to do with the material. Some of the material was interesting but none of it was connected to each other. Grading was easy but kind of felt like a waste of time overall"
Government,298,Cornell University,Mona,,Krewel,2361537,1,good,TEACHER,PROFESSOR,4.0,4.0,4.0,GOVT2293,"Prelims are based on lecture content, so study the slides. Make sure to manage your time well with the final term paper. Overall, the class was well put together and Professor Krewel is a very knowledgable lecturer."
German,298,Cornell University,William,,Krieger,2455301,0,zero,TEACHER,PROFESSOR,N/A,,,,
Government,298,Cornell University,Douglas,,Kriner,2504388,14,good,TEACHER,PROFESSOR,3.6,5.0,5.0,GOVT1111,"Professor Kriner was really knowledgeable about American Government, and I learned a lot in his class. What I disliked about this class were the TAs. Mine graded extremely harshly without giving good feedback and barely covered the readings during discussion."
Engineering,298,Cornell University,Vikram,,Krishnamurthy,2410214,5,good,TEACHER,PROFESSOR,4.2,5.0,5.0,ECE2720,He genuinely wants his students to do well. He is really passionate about what he does. He cares more about us understanding the content than getting the exact right answers and his homework and exams are graded accordingly. He actively asks for feedback and follows through on it. A really sweet and understanding guy who cares about his students:)
Russian Studies,298,Cornell University,Raissa,,Krivitsky,2220003,1,good,TEACHER,PROFESSOR,5.0,5.0,5.0,RUSSA1121,"Gets annoyed when students don't know what she means when she says something in Russian, but otherwise amazing"
Psychology,298,Cornell University,Amy,,Krosch,2673960,1,good,TEACHER,PROFESSOR,5.0,5.0,5.0,PSYCH4800,"Krosch is one of my favorite professors at Cornell. She's understanding and accommodating (even providing multiple ways to get participation points beyond speaking up during class -- more than I would have expected from any prof!), and her line of work is super interesting and engaging. I really hope to take another class w/her in the future :)"
Writing,298,Cornell University,Megan,,Kruer,1930019,2,good,TEACHER,PROFESSOR,5.0,5.0,5.0,FRCH1114,"She is a motivated professor, you can tell she loves to teach and that makes me more motivated.  There is online homework 4 days/week and a quiz every other week.  Definitely read the textbook, study 30 minutes a day, do all online homework, and you'll be good. Oh yeah,participation is not even optional so you will either sink like Titanic or float"
Psychology,298,Cornell University,Carol,,Krumhansl,1179799,5,average,TEACHER,PROFESSOR,3.1,4.0,4.0,PSYCH4180,"Prof. Krumhansl is very knowledgeable and genuinely wants you to do well, but you have to put in the work and go to her for help. You can get away with not going to class because the textbook is really great in explaining everything she talks about in class, but try not to miss too much because she will definitely notice."
City & Regional Planning,298,Cornell University,Neema,,Kudva,636260,25,average,TEACHER,PROFESSOR,2.9,4.0,4.0,CRP1106,very unpleasant person
Computer Science,298,Cornell University,Volodymyr,,Kuleshov,2625462,0,zero,TEACHER,PROFESSOR,N/A,,,,
Government,298,Cornell University,Alexander,,Kuo,1881346,0,zero,TEACHER,PROFESSOR,N/A,,,,
Computer Science,298,Cornell University,Andrew,,Kuramoto,2241065,1,good,TEACHER,PROFESSOR,5.0,5.0,5.0,CS1110,"Andrew is probably has the best triceps in the university, small back though. Probably seems like the type of guy to be awful at FIFA."
Hotel & Restaurant Management,298,Cornell University,Matthew,A,Kurtas,1837823,0,zero,TEACHER,PROFESSOR,N/A,,,,
Not Specified,298,Cornell University,Sarosh,,Kuruvilla,308440,14,average,TEACHER,PROFESSOR,3.1,5.0,5.0,ILRIC2350,too much material for one exam
Human Ecology,298,Cornell University,Tamar,,Kushnir,1433529,25,good,TEACHER,PROFESSOR,4.0,5.0,5.0,HD1150,"Pretty good professor. She says things like ""come visit me in office hours, I'd love to meet all of you"", but then she doesn't ever seem particularly friendly or interested. Overall though it's a fun class, the textbook is good, and prof Kushnir is solid."
Engineering,298,Cornell University,Bruce,,Kusse,132111,27,good,TEACHER,PROFESSOR,4.2,5.0,5.0,AEP4220,Great guy. He doesn't even make us add. He knows what he's talking about.
Marketing,298,Cornell University,Robert ,,Kwortnik,1979514,8,average,TEACHER,PROFESSOR,2.9,5.0,5.0,HADM7430,did not learn much and too much work
Economics,298,Cornell University,Steven,,Kyle,384533,34,good,TEACHER,PROFESSOR,4.0,4.0,4.0,AEM2800,"There was 8 papers, each had a rough draft, peer review, and final. Gives you the questions to the papers ahead of time so you can begin writing as you please. The final is an in class essay that he gives you the questions for. He knows his stuff and can be interesting."
Communication,298,Cornell University,Emily,,La,2723163,1,good,TEACHER,PROFESSOR,5.0,5.0,5.0,COMM1101,Would take another class with Emily!
History,298,Cornell University,Walter,,LaFeber,161645,14,good,TEACHER,PROFESSOR,4.9,5.0,5.0,HIST313414,"I studied under Professor LaFeber back in the late 1970s as an undergraduate at Cornell.  He is the best teacher I've ever had.  He has the ability to inspire you with his command of and passion for the material.  He demands excellence.  The lectures were a high art form, organized around a 3-word outline and including great anecdotes. Magnifcent."
Health Science,298,Cornell University,Dawn,,Lafferty,2104096,9,good,TEACHER,PROFESSOR,4.7,5.0,5.0,HSN201,"This is one amazing person. I cannot stress enough how egalitarian and open this Professor is. Knows her material, comes to class prepared and is always willing to answer questions, stay after class or attend study groups. Incredibly humble and quiet. Fantastic Instructor!"
Information Science,298,Cornell University,Carl,,Lagoze,560029,8,average,TEACHER,PROFESSOR,3.1,5.0,5.0,INFO4302,The class is merely okay.
Asian Studies,298,Cornell University,Clement,,Lai,1123416,2,good,TEACHER,PROFESSOR,5.0,5.0,5.0,AAS110,One of the best teachers I've ever had. Really knows how to engage the students and teach about pertinent issues that affect students of color.
Cultural Studies,298,Cornell University,Mukti,,Lakhi,1021731,3,good,TEACHER,PROFESSOR,5.0,5.0,5.0,ENGL1152,One of the most enjoyable learning experiences I have ever had.
Engineering,298,Cornell University,Amit,,Lal,260180,16,average,TEACHER,PROFESSOR,2.6,4.0,4.0,ENGRI1820,"Hilarious professor. Knows his material well, and the lectures are super clear. The labs are great fun, and the grading is quite easy. However, the course itself has little structure, and can occasionally get very tough. There is no textbook and assignments and exams are mostly research-based."
Anthropology,298,Cornell University,Bernd,,Lambert,37204,7,good,TEACHER,PROFESSOR,4.6,4.5,4.5,ANTHR300,The best professor I had. Wonderful scholar.
Chemistry,298,Cornell University,Kyle,,Lancaster,1841153,32,good,TEACHER,PROFESSOR,4.5,5.0,5.0,CHEM2090,He was very understanding of the struggle of this year for students and curved the class to a B+ instead of a B for us. Tried to make zoom as fun as he could and dressed up with his TA every so often. Material is pretty standard chem matieral but was a lot of material bc gen chem. Taught the material pretty well too.
Engineering,298,Cornell University,Bruce,,Land,132604,23,good,TEACHER,PROFESSOR,4.4,5.0,5.0,ECE5760,"One of the best classes at Cornell, but it is a life-consuming amount of work. Bruce dedicates the majority of his time to the class and is always available to help you succeed at the incredibly daunting lab assignments."
Mathematics,298,Cornell University,Marie,B,Langlois,2470290,15,good,TEACHER,PROFESSOR,4.5,5.0,5.0,MATH2210,"The class was very difficult, so I wouldn't have managed without Prof's help. She's really amazing and is a great lecturer. Her office hours are very, very, very helpful (I went to almost every single one)."
Anthropology,298,Cornell University,Stacey,,Langwick,1362748,10,average,TEACHER,PROFESSOR,3.4,4.0,4.0,BSOC2468,"Professor Langwick's lectures are really interesting and sometimes engaging, but her explanations tend to be long so students tend to doze off. Heavily based on the readings and doesnt allow tech. Lots of discussion posts since 1/2 of the class was online this year. The TA I had was very easy-going and was an easy grader."
English,298,Cornell University,Orlando,,Lara,1672996,1,good,TEACHER,PROFESSOR,5.0,5.0,5.0,ENG1168,Awesome Professor! Always there to help give guidance and support. Take this class...Amazing class...
Asian Studies,298,Cornell University,Naomi,,Larson,1633684,13,good,TEACHER,PROFESSOR,4.9,5.0,5.0,JAPAN1101,"Despite my poor performance (compared to the median grade), This was by far my favorite and most difficult class. The lectures are amazing, but be prepared to be assessed at every discussion on your in-class performance. I believe my grade reflects my proficiency in Japanese, and I look forward to 5 more semesters of Japanese!"
Architecture,298,Cornell University,Medina,,Lasansky,714044,13,average,TEACHER,PROFESSOR,2.7,5.0,5.0,ARCH1801,"AMAZING lecturer. Extremely knowledgable with a few jokes. I never read the textbook for first year history, but you might for her electives. Tests and essays are based almost entirely on her lectures, so you really need to go and pay attention. Due to her medical condition, she can be hard to understand. I sat in front and didn't have an issue."
Law,298,Cornell University,Mitchel,,Lasser,1618026,0,zero,TEACHER,PROFESSOR,N/A,,,,
English,298,Cornell University,Laurel,,Lathrop,1534731,2,good,TEACHER,PROFESSOR,5.0,5.0,5.0,ENGL2800,"I liked writing before going to class and I grew a lot as a writer because of it. Excellent, honest feedback that was not harsh. She encouraged all kinds of writers, including students who lacked creativity. Assignments were fairly light and fair, and the class had a good pace."
Marketing,298,Cornell University,Michael,S,Latour,1804664,0,zero,TEACHER,PROFESSOR,N/A,,,,
Asian Studies,298,Cornell University,Chrissy,,Lau,1871347,4,good,TEACHER,PROFESSOR,4.6,5.0,5.0,2130,"Lectures are definitely worth attending as the material is engaging,  and will definitely be tested on. Professor Lau is a sweet person and a very good lecturer and a fair grader. You will learn a lot from her Asian American History class."
Natural Resources,298,Cornell University,Bruce,,Lauber,2401088,3,good,TEACHER,PROFESSOR,4.7,5.0,5.0,NTRES4600,"Bruce is wonderfully aware of student dynamics in his classroom. He states his expectations clearly and reiterates often. His homework assignments are not too demanding. He is the ""cool dad"" type who is down-to-earth and very kind."
Agriculture,298,Cornell University,Julie,,Lauren,2542857,0,zero,TEACHER,PROFESSOR,N/A,,,,
Religious Studies,298,Cornell University,Jane Marie,,Law,192501,69,good,TEACHER,PROFESSOR,4.5,5.0,5.0,ASIAN2211,"Jane Marie-Law knows Japan extremely well and uses her class as a gateway to observe Japanese through multiple lenses. If you are interested in cultural analysis her class is enjoyable. There are many opportunities to earn extra credits---""bonanza points""---so getting an A won't be a problem. Definitely go to her office hours. You'd learn more."
Near Eastern Studies,298,Cornell University,Atoor,,Lawandow,2354647,0,zero,TEACHER,PROFESSOR,N/A,,,,
Labor amp Employment Relations,298,Cornell University,Edward,,Lawler,2631920,0,zero,TEACHER,PROFESSOR,N/A,,,,
Languages,298,Cornell University,Cecilia,,Lawless,328895,36,good,TEACHER,PROFESSOR,3.6,5.0,5.0,SPAN2095,"I agree with past comments that she's all over the place. Her class is literally a chaotic mess. Also, shes had a few ""problematic"" comments to say about peope of color. I dont recommend taking any class with her."
Hospitality,298,Cornell University,Benjamin,C,Lawrence,1804392,3,good,TEACHER,PROFESSOR,4.5,5.0,5.0,HA1360,"Hands down the best professor I've had so far at the Hotel School. Professor Lawrence is HILARIOUS and gives amazing, informative, and interesting lectures. One of the few classes I always looked forward to going to!"
Art History,298,Cornell University,Claudia,,Lazzaro,16596,12,good,TEACHER,PROFESSOR,3.8,4.0,4.0,ARTH2400,"boring class, but good professor"
Biology,298,Cornell University,Brian,P,Lazzaro,1895684,4,good,TEACHER,PROFESSOR,4.5,4.5,4.5,BIOEE1780,"He is an absolutely wonderful professor! He is helpful and his lectures are always interesting. Very open and thoughtful. The one draw back is that the exams are all over the place in what is considered important material. On a side note, I took this course for writing in the majors and it was amazing! Would definitely take a course of his again!"
German,298,Cornell University,Sofia,,Leacuteonard,2688816,0,zero,TEACHER,PROFESSOR,N/A,,,,
Human Ecology,298,Cornell University,Tashara,,Leak,2650278,1,good,TEACHER,PROFESSOR,5.0,5.0,5.0,NS1600,Dr. Leak was an incredible professor that put time into being available to students outside of class via coffee chats. She is one of the most inspiring professors I have had at Cornell and really takes the time to explain the details of what it means to be a public health professional unmatched to any other professor in the NS department.
English,298,Cornell University,Adin ,,Lears,1979176,1,good,TEACHER,PROFESSOR,5.0,5.0,5.0,ENGL1191,"I entirely expected to hate this class considering it was an English FWS, but it turned out to be my favorite class the entire semester. Dr. Lears is very flexible with meeting and also when it comes to extensions. Criticism is very helpful and constructive. Highly recommend!"
Hospitality,298,Cornell University,Daniel,,Lebret,1303408,7,good,TEACHER,PROFESSOR,4.5,4.0,4.0,HADM4205,I enjoyed this class a lot. Very helpful to industry.
Physics,298,Cornell University,Andre,,Leclair,1708584,37,good,TEACHER,PROFESSOR,3.5,5.0,5.0,PHYS4443,"Completely disengaged lecturer. Most students stopped showing up because we realized the textbook was a far better teacher. He also curved DOWN the raw scores, which is unheard of in the physics department."
Computer Science,298,Cornell University,Lillian,,Lee,232759,8,good,TEACHER,PROFESSOR,4.5,5.0,5.0,CS1110,"Lee is an incredible professor! She didn't lecture for 1110 (Bracy did) but she crafted all the labs and assignments. The labs were immensely helpful in learning new material and the assignments--though rather difficult--prepared you greatly for exams. She's always willing to help: talking after class, responding on Piazza, or meeting individually."
Biology,298,Cornell University,Siu Sylvia,,Lee,1664758,2,average,TEACHER,PROFESSOR,2.8,4.0,4.0,BIOMG4370,Very interesting and great class. Highly recommend taking this class. It is not terribly difficult and half of the class is participatory discussion. Loved it!
English,298,Cornell University,Nicollette,,Lee,2279683,0,zero,TEACHER,PROFESSOR,N/A,,,,
Organizational Behavior,298,Cornell University,Alice,J,Lee,2599202,2,good,TEACHER,PROFESSOR,5.0,5.0,5.0,ILROB4795,"Easily the best course I have taken, as a rising senior in ILR, so far in my time at Cornell. I genuinely loved attending class each week. Every single student at Cornell should enroll in this course: super light workload and unbelievably useful skills learned which I have already put into practice."
Business,298,Cornell University,David,,Lee,195462,30,average,TEACHER,PROFESSOR,3.5,5.0,5.0,AEM2300,"Really great professor and lecturer. Lectures were detailed and clear, content roughly correlated with the textbook, and homework was pretty easy if done after reading the book. Lecture slides directly correlated to test questions, and plenty of flexibility with choosing paper topic (there was 1 big paper when I took this class)."
Biomedical Engineering,298,Cornell University,Esak,,Lee,2688809,2,good,TEACHER,PROFESSOR,3.5,4.0,4.0,BME1310,"Prof. Lee is a very smart, funny and caring guy, however he may have not been the best choice for an intro class. His exams are hard and there are few resources to help you prepare for them outside of the in class powerpoints. The TAs for this class were incredibly unhelpful, so it is difficult to seek help unless you go to his few office hours."
Science,298,Cornell University,Stephen,,Lee,9789,81,average,TEACHER,PROFESSOR,3.2,5.0,5.0,CHEM2070,"Ill be honest; I hated this class with a passion. I took Chem 2070 (along w Bio) to see if I wanted to pursue Pre-Med, and I have decided to weed myself out  The material and the prelims are very difficult, and his lectures are pretty surface-level. He does provide many resources, but it is truly a HUGE time commitment."
Linguistics,298,Cornell University,Julie,,Legate,1030512,4,average,TEACHER,PROFESSOR,2.9,4.0,4.0,LING300,Distant and cold. Did not enjoy her as a professor. Hardly taught. Was unnecessarily difficult in accepting my final project and assigning a grade. Caused my degree to be withheld. I do not recommend.
Earth Science,298,Cornell University,Flavio,,Lehner,2707035,1,good,TEACHER,PROFESSOR,5.0,5.0,5.0,EAS2900,"A solid introduction to python using interesting meteorological examples, homework coding assignments are given after the lecture portion of class concludes to start on with the prof present and then due before the next class (usually 2 assignments per week). Accessible outside of class to help understand assignments or run thru issues in code."
