tDept,tSid,institution_name,tFname,tMiddlename,tLname,tid,tNumRatings,rating_class,contentType,categoryType,overall_rating,review_quality_rating,review_difficulty_rating,review_class,review
Engineering,298,Cornell University,Cynthia,,Reinhart-King,1634805,2,good,TEACHER,PROFESSOR,4.5,4.5,4.5,BME6670,"Overall, the class was interesting and fairly enjoyable. However, some of the lecturers were boring and lectured beyond our knowledge. Also, the HW focused only on a few guest lecturers, and ignored the rest. The project wasn't too bad, but wasn't well organized and the directions were vague. Decent class overall, but could be better organized."
Engineering,298,Cornell University,James,,Renegar,193652,22,average,TEACHER,PROFESSOR,3.4,5.0,5.0,ORIE5370,The real deal in ORIE. Make sure to take his classes if you want to learn some good old mathematics. Took his 5370 back in 2016. Hope he still teaches the class. The guy has high level of seriousness in both teaching and research. Legend.
Engineering,298,Cornell University,Sidney,,Resnick,530590,28,poor,TEACHER,PROFESSOR,2.0,5.0,5.0,ENGRD2700,"Very unclear lectures, although his jokes are sometimes amusing. If you don't do well on the midterm, then 70% of your final grade depends on your final exam score, which is crazy thinking that your entire semester comes down to a 2.5 hour test. The curve must have been good though since somehow I did fairly well while not knowing anything."
Human Ecology,298,Cornell University,Adriana,,Reyes,2586005,1,good,TEACHER,PROFESSOR,4.0,4.0,4.0,PAM3180,"Prof. Reyes is very sweet. Her lectures are not the most enthusiastic but the content is interesting and she clearly knows what she is talking about. The class wasn't too hard either. iClickers are used to track attendance, 5 short papers on the readings, a book report with a group presentation, and policy brief. Great/easy class for HCP minors."
Languages,298,Cornell University,William,,Reyes-Cubides,1695327,30,good,TEACHER,PROFESSOR,4.8,5.0,5.0,SPAN1230,"Interesting, challenging, fun, understanding, but most of all relevant! I am currently on vacation in Costa Rica and I have been able to communicate with the locals and participate in all kinds of conversations. The feeling is amazing! Before taking his class I could only mumble a few words and phrases in Spanish."
History,298,Cornell University,Jacqueline,,Reynoso,2167253,5,good,TEACHER,PROFESSOR,3.6,5.0,5.0,HIST366,"I absolutely loved this class. She was by far one of the most knowledgeable history professors I've had at any school. She explained things very thoroughly, and had the ability to add depth and complexity to subjects other teachers might gloss over or simplify. IMO, a class with her is a must for history majors at CSUCI."
English,298,Cornell University,Alice,,Rhee,2710393,4,good,TEACHER,PROFESSOR,4.8,5.0,5.0,ENGL2800,"Alice is an awesome professor. She is very caring, kind, and understandable. Because her class is seminar/discussion like, it helps to be an active participant in the class. Helps everyone make class enjoyable. She offers feedback and is helpful to students. Professor Alice is also lenient on extensions"
English,298,Cornell University,Emily,,Rials,2373967,2,good,TEACHER,PROFESSOR,5.0,5.0,5.0,LIBA1290,Incredible teacher! She was always great at answering questions and clearing up any confusion. Gave a lot of great feedback on papers and was very understanding of student's workload. I can definitely say I am a better writer because of her!
Political Science,298,Cornell University,Peter,,Rich,2419833,11,good,TEACHER,PROFESSOR,3.5,4.0,4.0,PAM2250,"Covers lots of interesting topics and is very engaging in lectures. Not hard if you do the readings and pay attention. However, there are alot of readings! Overall nice professor though."
Engineering,298,Cornell University,Brian,,Richards,2703011,1,good,TEACHER,PROFESSOR,5.0,5.0,5.0,BEE3299,Taken online but doesn't matter bc this class has no lectures! SD is a great class where all you do is a weekly assignment for a long-term project of your choosing. If you simply do all the work by the rubrics and the EC you will get an A+. The prof is helpful in office hours if you need. Highly recommend this class!
Music,298,Cornell University,Annette,,Richards,2035548,4,good,TEACHER,PROFESSOR,5.0,5.0,5.0,MUS2244,very chill class
Physics,298,Cornell University,Betty,,Richardson,736895,7,poor,TEACHER,PROFESSOR,2.0,5.0,5.0,PHYS101102,She is usually available outside of class
African Studies,298,Cornell University,Richã©,,Richardson,1685791,0,zero,TEACHER,PROFESSOR,N/A,,,,
Architecture,298,Cornell University,Henry,,Richardson,2006131,0,zero,TEACHER,PROFESSOR,N/A,,,,
African Studies,298,Cornell University,Riché,,Richardson,2338017,2,good,TEACHER,PROFESSOR,4.5,4.0,4.0,ASRC1822,"Great professor. Often goes on tangents but always somehow relates them perfectly back to the course material. She loves class participation and encourages risk-taking (in terms of a thesis). Gives good feedback, but ultimately it is not hard to get an A."
American Indian Studies,298,Cornell University,Troy,,Richardson,1794256,5,poor,TEACHER,PROFESSOR,2.2,4.0,4.0,AIS1110,"Material is really interesting but professor richardson reads his lectures which makes them hard to follow. He changes the syllabus randomly and doesn't respond to emails. I never knew where I stood with him, he gave very little feedback. I never really talked to him because he seems really unapproachable. I did well but would not take again."
Civil Engineering,298,Cornell University,Ruth,,Richardson,1184943,11,good,TEACHER,PROFESSOR,4.2,4.0,4.0,CEE3510,"3510 mostly reviews the material of 2510 but in greater depth, which is helpful due to how horrible 2510 is. Richardson is overall very helpful, fair, and sets reasonable expectations. The course is a bit disorganized, and not always the most interesting, but overall pretty solid."
American Indian Studies,298,Cornell University,Jolene,,Rickard,1247898,10,average,TEACHER,PROFESSOR,3.5,5.0,5.0,VIST2000,"As someone who was not really interested in visual studies, this course helped me to gain a true appreciation for things that I otherwise take for granted. I'm not sure if any of my other classes have influenced me in this way yet. Overall, I learned a lot!!"
History,298,Cornell University,Russell,,Rickford,2109290,3,good,TEACHER,PROFESSOR,4.3,5.0,5.0,AMST1595,"Professor Rickford's class was so great because he taught such an essential topic in a way that made it easy to understand. He goes a bit fast during his lectures, but he is hilarious, and you will definitely learn a lot."
Labor & Employment Relations,298,Cornell University,Chris,,Riddell,1828965,5,good,TEACHER,PROFESSOR,3.5,4.0,4.0,ILRLR2050,"Took him for labor relations. Lectures are scattered and  unclear. Bargaining sim, two tests, participation papers. group work heavy. Minimal work for the actual class, and Riddell is a cool and very nice guy. You probably won't learn more than the basics of labor relations. Significantly less work than Aleks."
Astronomy,298,Cornell University,Dominik,,Riechers,2352446,1,good,TEACHER,PROFESSOR,4.0,4.0,4.0,ASTRO2211,Lectures can be a bit dry but he's a good teacher. Answers any questions or concerns you have and is very helpful if you need any help. Problem sets aren't necessarily hard but take a lot of work. Pretty heavy on conceptual knowledge so make sure you actually understand what your equations mean
Economics,298,Cornell University,Evan,,Riehl,2341741,5,good,TEACHER,PROFESSOR,4.4,5.0,5.0,ILRLE2400,"Not an approachable teacher nor a fair grader. After going to his OH after a bad grade, he didnt offer any advice and just said that I was unlucky and do better on the next test. Also on one homework he agreed my answer was right but since it was not what the key said he gave no points back. He also lacked any empathy or understanding."
Earth Science,298,Cornell University,Susan,,Riha,2432925,0,zero,TEACHER,PROFESSOR,N/A,,,,
Mathematics,298,Cornell University,Timothy,,Riley,2201228,0,zero,TEACHER,PROFESSOR,N/A,,,,
Mathematics,298,Cornell University,Tim,,Riley,1634915,4,good,TEACHER,PROFESSOR,4.0,5.0,5.0,MATH2210,"Good professor, fun class"
Accounting,298,Cornell University,Marquise,,Riley,2666869,7,good,TEACHER,PROFESSOR,5.0,5.0,5.0,AEM2225,"Riley is great. He makes accounting much easier to understand. He understands students and is willing to work with them. The class was graded on three, noncumulative prelims, weekly HW, and quizzes which they review before you have to turn them in and participation. 100% recommend"
Labor  Employment Relations,298,Cornell University,Ben,,Rissing,2250227,16,good,TEACHER,PROFESSOR,5.0,5.0,5.0,ILROB1120,"Professor Rissing has been my favorite professor at Cornell so far. His lectures are amazing. They are very engaging and the course material is very interesting. He is a fun professor and I never tire of listening to him. Spectacular guy. Also has an unbelievable resume for his age. Even if I tried, I couldn't say one bad thing about him. Legend."
Engineering,298,Cornell University,Hadas,,Ritz,1526046,32,good,TEACHER,PROFESSOR,3.7,5.0,5.0,MATH2930,"I was often confused during the semester because the material was difficult, but the lectures were so organized and help was so available that it was not difficult to catch up when I fell behind."
English,298,Cornell University,John,,Robbins,1443913,3,good,TEACHER,PROFESSOR,4.8,5.0,5.0,ENGL1127,"I signed up for Prof Robbins's Shakespeare FWS to impress my significant other, and I left with my own appreciation for the surprising relevance of WIlliam's work (he parses WS like a surgeon). Agreed. Robbins places a huge emphasis on individual growth - essays become personal explorations. There are few profs more patient and caring."
History,298,Cornell University,Camille,A,Robcis,1754282,1,good,TEACHER,PROFESSOR,4.0,4.0,4.0,HIST3343,"Excellent class, encourages students to explore some difficult works. Read and participate actively. "
Political Science,298,Cornell University,Kenneth,,Roberts,807343,8,good,TEACHER,PROFESSOR,4.2,5.0,5.0,GOVT3290,"professor roberts is by and above one of my favorite professors at cornell. incredibly insightful and experiencedexpect some wild anecdotes. also, make a point to go to his office hours. he has a wealth of knowledge that he's willing to share, and is amazing for book recommendations or if you just want to chat. couldn't recommend him enough!"
Philosophy,298,Cornell University,Clifford,,Roberts,1691335,2,good,TEACHER,PROFESSOR,4.8,5.0,5.0,PHIL1112,"Cliff is a great instructor.  He's more than willing to meet and talk over the material or current assignments.  He is very knowledgeable, and makes the material really clear.  You'll definitely learn how to analyze complex arguments and write a good philosophy paper."
Hospitality,298,Cornell University,Dave,,Roberts,2699926,6,good,TEACHER,PROFESSOR,5.0,5.0,5.0,HADM1350,Dave Roberts is far and away the best professor at Cornell. He puts in a ton of effort to make sure his students enjoy the class and get as much as possible out of it. He is one of the nicest people around and really cares about his students.
Human Development,298,Cornell University,Steven,,Robertson,529936,2,good,TEACHER,PROFESSOR,4.5,4.0,4.0,HD3440,"I really enjoyed the topics. Lectures therefore were not boring for me, but you need to take a lot of notes during class. Exam questions often about small things he said in lecture, so take good notes. He is very nice and approachable. Need to study a lot though. Exams are fair and workload isn't too large, so overall great class and professor!"
Human Ecology,298,Cornell University,X,,Robertson,1384914,2,good,TEACHER,PROFESSOR,5.0,5.0,5.0,HD3440,"Seriously the best professor I have had in my 3 years at Cornell. The topics are great, he's very engaging, he makes you want to go to the class every week. The discussion attendance is mandatory, but also pretty interesting. Everyone should take this class. I'm taking two of his classes next semester. He's great."
Art History,298,Cornell University,Cynthia,,Robinson,2654551,2,good,TEACHER,PROFESSOR,3.5,4.0,4.0,ARTH2355,"The online format made the class 90% straight up lecture, 5% asking students to participate, and 5% about rabbits. Professor Robinson is definitely very knowledgeable about what she's teaching, especially since she is considered a leading scholar in the field. However, it can be quite abstract, and lectures are VERY important."
Engineering,298,Cornell University,Richard,,Robinson,1986662,4,poor,TEACHER,PROFESSOR,1.5,,,MSE2060,"The homeworks are tedious and pretty long. Difficulty isn't extreme but pretty long since 2 week problem sets. Going to class is useful but the tone of voice is hard to focus with. You can learn most things independently as several chose to do. Interesting subject, but would be more interesting with a more interesting lecture style"
Sociology,298,Cornell University,Ewan,,Robinson,2727307,1,poor,TEACHER,PROFESSOR,2.0,,,DSOC1200,"Prof. Robinson is kind, knowledgeable, and will definitely help you be a better writer. That being said, he has no idea how to structure a FWS class. He assigns 2 or 3 times more work than the average FWS professor and grades extremely harshly. Take at your own risk."
Hospitality,298,Cornell University,Stephani,,Robson,182113,20,good,TEACHER,PROFESSOR,4.2,5.0,5.0,HADM2550,"Professor Robson is the absolute best! Her lectures are so informational and she is just amazing in her field. She made the grading criteria clear and I never got confused in this class. Although lectures are not mandatory, it is highly recommended that you don't miss them. They are fast and cover lots of information not showing in the slideshow."
Classics,298,Cornell University,Courtney,,Roby,1700389,4,average,TEACHER,PROFESSOR,3.3,4.0,4.0,CLASS1100,Had her for an FWS. nice and fun teacher. seems like a big nerd (in the good way). not the best at facilitating a useful discussion though. Overall pretty easy grader.
Science Technology amp Society,298,Cornell University,Cara,,Rock-Singer,2367903,0,zero,TEACHER,PROFESSOR,N/A,,,,
Near Eastern Studies,298,Cornell University,Aaron,,Rock-Singer,2369971,3,good,TEACHER,PROFESSOR,4.3,5.0,5.0,HISTORY205,"I really loved Prof. Rock-Singer's lectures because they cleared up anything I didn't understand in the pre class readings. His class definitely packed a lot of information about pre-modern Islamic civilization, but coming from no previous knowledge on this topic, it was easy to succeed if you do the readings and attend lecture."
Natural Resources,298,Cornell University,Paul,,Rodewald,2517592,0,zero,TEACHER,PROFESSOR,N/A,,,,
English,298,Cornell University,Will,,Rodgers,1377662,2,average,TEACHER,PROFESSOR,2.8,4.5,4.5,ENGL1109,I love Will
Languages,298,Cornell University,Jose Maria,,Rodriguez-Garcia,528779,21,good,TEACHER,PROFESSOR,4.9,5.0,5.0,SPAN214,"Extremely helpful, explains readings really well. Also one of the nicest professors out there. This class could have been awful with a different professor but Jose made it interesting."
Asian Studies,298,Cornell University,Kristin,,Roebuck,2590381,6,good,TEACHER,PROFESSOR,4.0,5.0,5.0,GOVT1623,Great and consistently interesting lecturer. Get ready to take a lot of notes because the way she makes slides but honestly she's really good at lecturing so if you're not taking notes on them you are wasting your time
Hotel  Restaurant Management,298,Cornell University,Sean,,Rogers,2134686,7,good,TEACHER,PROFESSOR,4.7,4.0,4.0,HADM1810,Make sure to take Intro to management with Rogers in the spring semester. He is a good lecturer and really wants the students to do well. The median grade for the class was an A. The most important thing for his exams is to memorize everything on his powerpoint slides.
Arts amp Sciences,298,Cornell University,Dehanza,,Rogers,2337183,0,zero,TEACHER,PROFESSOR,N/A,,,,
Comparative Literature,298,Cornell University,Marcela,,Romero Rivera,1824246,1,average,TEACHER,PROFESSOR,3.0,,,SPAN203,"Pretty easy Spanish class if you are confident with your Spanish. Class is almost completely taught in Spanish and students are asked to actively participate (in Spanish only). Not a heavy homework load, and we spend a lot of time going over grammar rules in class, but they aren't taught very well. Watch a lot of videos and listen to songs."
History,298,Cornell University,Noliwe,M,Rooks,2583922,1,poor,TEACHER,PROFESSOR,1.0,,,AMST1101,"Prof Rooks was one of the worst professors I've had. She made it pretty clear that she did not care about the class and rarely showed up. If she did come, she was hardly ever prepared. Some of the grading was really frustrating and we had pop quizzes that asked really specific questions that were just to see if we read, not if we understood it."
Languages,298,Cornell University,Mats,,Rooth,858267,3,poor,TEACHER,PROFESSOR,2.1,,,CS4744,"Prof clearly cares about the material and his students, but is not the best lecturer. We had one class where the TA taught instead, and she was a better lecturer. Prof is accessible outside of class and grading is lenient. Going to OH helps a lot."
Languages,298,Cornell University,Félix,Miguel,Rosario Ortiz,2372167,3,good,TEACHER,PROFESSOR,5.0,5.0,5.0,SPAN2180,Amazing class and amazing lecturer
Government,298,Cornell University,Bryn,,Rosenfeld,2669872,2,good,TEACHER,PROFESSOR,5.0,5.0,5.0,GOVT2283,One of the best GOVT professors at Cornell University. I personally think that her Political Institutions Under Autocrats class was difficult BUT it is one of the most interesting and useful classes I have taken at this school! I would gladly take another class with Prof. Rosenfeld.
Philosophy,298,Cornell University,Saul,,Rosenthal,1401105,1,good,TEACHER,PROFESSOR,4.0,4.0,4.0,PHIL1112,"Great professor who knows alot. Nice guy and very approachable and helpful. The only problem is the class. The material can be pretty dry and instead of abstract thought, the class focuses mainly on plotting the arguments. Just wasn't my style of learning."
Fine Arts,298,Cornell University,Douglas,,Ross,1536129,8,good,TEACHER,PROFESSOR,4.2,5.0,5.0,ART3499,"Professor Douglas is the most encouraging and guiding artist I've studied with. He is a ""yes, and..."" professor, building on your ideas with his wealth of knowledge and acute perception. I've made some of my most boundary-pushing work under Douglas. It's also really easy to get along with him and he has great style."
Education,298,Cornell University,Judy,,Ross-Bernstein,492459,4,average,TEACHER,PROFESSOR,3.0,5.0,5.0,HD001,She is the best professor I've had yet!! Too bad she's gone because HD is hurting without her. She was very considerate and helped me figure out my future!
Law,298,Cornell University,Faust,,Rossi,1009112,6,good,TEACHER,PROFESSOR,4.8,4.0,4.0,CIVPRCIV,"Finest professor at cornell.  Had him for civil pro, evidence and trial tactics.  Went that extra mile for me and concepts from him are still with me after 30 years of practicing law.  He and Clermont were in a league by themselves."
Social Science,298,Cornell University,Margaret,,Rossiter,411462,3,good,TEACHER,PROFESSOR,4.2,4.5,4.5,STS1121,She's great
Languages,298,Cornell University,Arina,,Rotaru,1073986,8,average,TEACHER,PROFESSOR,3.1,4.5,4.5,GERST1140,"Gives great feedback on essays and really helps with writing. Class discussions are difficult because she tends to be rather long winded (making it very difficult to get a word in) and then is disappointed that we don't talk more. Not the greatest class I've ever taken, but far from the worst."
English,298,Cornell University,Nick,,Roth,1406118,3,good,TEACHER,PROFESSOR,4.7,5.0,5.0,FWS,"He was great and very knowledgable about film. He's very fair and really great to meet with. When it comes to writing papers, he expects you to try and come up with good points but he's not one of those teachers who needs you to agree with them. Look him up on google you'll find him in this movie called Berkeley. HIGHLY RECOMMEND"
Business,298,Cornell University,Ken,,Rother,2456128,0,zero,TEACHER,PROFESSOR,N/A,,,,
Languages,298,Cornell University,Jeannine,,Routier-Pucci,913566,9,good,TEACHER,PROFESSOR,4.7,5.0,5.0,SPAN2190,"Great professor!  Best language course I've ever taken, hands-down.  She gives great feedback and is very approachable, always friendly, and happy to clear up anything that might confuse her students.  As she said at the end of class, she will not be teaching any more classes at Cornell, but her clear and engaging style will surely be missed!"
Philosophy,298,Cornell University,Eric,,Rowe,2063015,3,good,TEACHER,PROFESSOR,4.8,5.0,5.0,PHIL1100,"I agree with the first post, his lectures were extremely interesting and engaging.  If you are motivated and are willing to put in the work, I highly recommend taking his class, you will learn a lot.  He is really on top of things and does his best to help you if you ask.  He gives excellent feedback on your essays."
Political Science,298,Cornell University,Diane,,Rubenstein,424014,5,good,TEACHER,PROFESSOR,3.9,4.0,4.0,GOVT4051,"Prof. Rubenstein goes on a lot of tangents. It took a few weeks to get used to the idea that you can't prepare for what she'll end up discussing in class, but once I accepted that, I actually really enjoyed the course. She knows what she's talking about, and she grades fairly. She was also available to go over papers in depth outside of class."
Mathematics,298,Cornell University,Daniel,,Rubin,2102864,0,zero,TEACHER,PROFESSOR,N/A,,,,
Organizational Behavior,298,Cornell University,Brian,,Rubineau,1258139,25,poor,TEACHER,PROFESSOR,2.4,5.0,5.0,MGCR222,Not much..
Economics,298,Cornell University,Ivan,,Rudik,2697956,0,zero,TEACHER,PROFESSOR,N/A,,,,
Engineering,298,Cornell University,Andrew,,Ruina,9721,58,average,TEACHER,PROFESSOR,2.9,5.0,5.0,MAE2030,"Logistically a mess due to Zoom. But he's a good, very old-school lecturer. I wish I had more time to spend on this course, because it was extremely rigorous and the hardest I've worked for 3 credits. I didn't enjoy it, but I appreciated what he was trying to do. I'm not a MechE so I wish I took it with someone else with a more streamlined approach"
Classics,298,Cornell University,Antonia,,Ruppel,832272,10,good,TEACHER,PROFESSOR,4.3,5.0,5.0,GREEK1102,always has extra time to explain something that isn't quite clear.
Engineering,298,Cornell University,David,,Ruppert,1295485,6,poor,TEACHER,PROFESSOR,2.1,4.5,4.5,ORIE4630,"Lectures are boring and I feel like sometimes the Prof. only reads the lecture to finish tasks given by the school but doesn't care about teach us anything at all. Disorganized lecture notes. The Prof. cannot even explain his own notes clearly. Financial background is not required but if you don't have any financial knowledge, you will SUFFER a lot"
Asian Studies,298,Cornell University,Bruce,,Rusk,915203,7,good,TEACHER,PROFESSOR,4.0,4.5,4.5,ASIAN2212,"The way the class is structured is that lectures mostly cover pots and paintings. The professor seems really helpful and nice, and he's pretty funny sometimes. But if you're not interested, it's kind of a hard class to stay awake in. Don't listen to the rumors-- you DO need to study for quizzes and put work into the essays. It's not a guaranteed A."
Engineering,298,Cornell University,Paat,,Rusmevichientong,1207375,3,good,TEACHER,PROFESSOR,5.0,5.0,5.0,ORIE5580,"Three words: helpful, enthusiastic, knowledgeable. Paat should win a Noble prize in teaching ..."
Accounting,298,Cornell University,Nerissa,,Russell,2589387,1,good,TEACHER,PROFESSOR,4.0,4.0,4.0,ARKEO2201,Good professor with very solid knowledge of the material. The class was graded completely based on lecture attendance and exams so it was straightforward. She makes it very clear which topics will be on the exams. The exams are mostly memorization-based.
Agriculture,298,Cornell University,Jonathan,,Russell-Anelli,646668,6,good,TEACHER,PROFESSOR,4.0,5.0,5.0,PLSCS2600,"He has passion but seems like he doesn't want to teach. He attempts to radiate positivity (""Go be awesome!"") yet comes across as irritated. Class was flipped with about 3-6 hours/week of videos. Monday is a lecture on lab, and the other two days are either a sloppy representation of the videos or busywork. Lots of extra effort with little return."
Communication,298,Cornell University,Toni,,Russo,145190,22,average,TEACHER,PROFESSOR,2.8,4.5,4.5,COMM201,great
Management,298,Cornell University,Joseph,Edward,Russo,2709590,0,zero,TEACHER,PROFESSOR,N/A,,,,
Classics,298,Cornell University,Jeffrey,,Rusten,380206,9,good,TEACHER,PROFESSOR,4.3,5.0,5.0,CLAS2651,"Awesome class (comic theatre), super interesting subject and Rusten teaches it exceptionally, very enthusiastic about the subject and very conversational teaching style. GPA saving class but also just an enjoyable part of my week."
Chemistry,298,Cornell University,Thomas,,Ruttledge,16475,145,average,TEACHER,PROFESSOR,3.5,5.0,5.0,CHEM2510,"Really recommend that you take this along CHEM3580, or after CHEM3580 if you can. He's always behind in lectures. Study the prelab very well and make sure to complete each objective to get the lab notebook points in the end. This course will take so much of your time so if you can take it in the summer I highly advise you to do just that."
Agriculture,298,Cornell University,Matthew,,Ryan,2378200,1,good,TEACHER,PROFESSOR,4.0,4.0,4.0,PLSCS3800,I really enjoyed the field trips to farms and guest speakers in this class.
